{
  "messageId": "message-id-example",
  "type": "EnqueueMatch",
  "version": "1.0.0",
  "occurredAt": "2026-09-08T12:00:00Z",
  "tenantId": "tenant-id-example",
  "regionId": "region-id-example",
  "clusterId": "cluster-id-example",
  "correlationId": "correlation-id-example",
  "data": {
    "policyId": "policy-id-example",
    "latencies": []
  },
  "idempotencyKey": "idempotency-key-example"
}
